{
  "schemaVersion": "1.0.0",
  "kind": "formulas",
  "packId": "cfa-l1-2027",
  "helperId": "cfa-helper",
  "title": "Starter formula bank (original wording)",
  "curriculumVersion": "2027",
  "contentVersion": "0.1.0",
  "license": "Original content by the app authors. Contains no third-party curriculum text, learning outcome statements, or questions.",
  "disclaimer": "Independent study tool. Not affiliated with or endorsed by CFA Institute. CFA® and Chartered Financial Analyst® are trademarks owned by CFA Institute.",
  "formulas": [
    {
      "id": "quant.future-value",
      "name": "Future value (lump sum)",
      "topicId": "quant",
      "conceptIds": [
        "quant.fv-pv"
      ],
      "category": "Time Value of Money",
      "equation": {
        "latex": "FV = PV\\,(1+r)^{N}",
        "plain": "FV = PV * (1 + r)^N"
      },
      "variables": [
        {
          "symbol": "FV",
          "name": "Future value",
          "unit": "currency"
        },
        {
          "symbol": "PV",
          "name": "Present value",
          "unit": "currency"
        },
        {
          "symbol": "r",
          "name": "Periodic interest rate",
          "description": "Rate per compounding period, as a decimal"
        },
        {
          "symbol": "N",
          "name": "Number of periods"
        }
      ],
      "purpose": "Finds what a single amount today grows to if it earns a steady compounded rate.",
      "whenToUse": "One deposit or investment, no interim cash flows, a known rate and horizon.",
      "assumptions": [
        "Rate stays constant",
        "Interest is reinvested each period"
      ],
      "workedExample": {
        "problem": "You invest 1,000 at 5% per year for 3 years. What is it worth at the end?",
        "steps": [
          "Convert 5% to 0.05.",
          "Compute 1.05^3 = 1.157625.",
          "Multiply: 1,000 x 1.157625."
        ],
        "answer": "FV ≈ 1,157.63"
      },
      "relatedFormulaIds": [
        "quant.npv"
      ],
      "commonMistakes": [
        "Using an annual rate with a quarterly or monthly N",
        "Typing 5 instead of 0.05",
        "Forgetting that N counts compounding periods, not years"
      ],
      "tags": [
        "tvm",
        "compounding"
      ],
      "difficulty": "foundational",
      "source": "original"
    },
    {
      "id": "quant.npv",
      "name": "Net present value (NPV)",
      "topicId": "corp",
      "conceptIds": [
        "corp.capital-budgeting",
        "quant.fv-pv"
      ],
      "category": "Capital Budgeting",
      "equation": {
        "latex": "NPV = \\sum_{t=0}^{N}\\frac{CF_t}{(1+r)^t}",
        "plain": "NPV = sum over t=0..N of CF_t / (1 + r)^t"
      },
      "variables": [
        {
          "symbol": "CF_t",
          "name": "Cash flow at time t",
          "description": "Negative for outflows, positive for inflows",
          "unit": "currency"
        },
        {
          "symbol": "r",
          "name": "Discount rate",
          "description": "Required return reflecting the project's risk"
        },
        {
          "symbol": "N",
          "name": "Final period"
        }
      ],
      "purpose": "Measures the value a project adds, in today's money, after covering the required return.",
      "whenToUse": "Judging whether to accept a project or choosing between mutually exclusive projects.",
      "assumptions": [
        "Cash flows are estimated correctly",
        "Discount rate fits the project's risk"
      ],
      "workedExample": {
        "problem": "A project costs 1,000 now and returns 400 at the end of each of 3 years. The discount rate is 10%. Find NPV.",
        "steps": [
          "PV of inflows = 400 x [1 - 1.10^-3] / 0.10 = 400 x 2.4869 ≈ 994.74.",
          "NPV = 994.74 - 1,000."
        ],
        "answer": "NPV ≈ -5.26, so reject on a pure NPV basis"
      },
      "relatedFormulaIds": [
        "quant.future-value"
      ],
      "commonMistakes": [
        "Discounting the time-0 outflow",
        "Using the wrong discount rate",
        "Ignoring the sign of cash flows"
      ],
      "tags": [
        "capital-budgeting"
      ],
      "difficulty": "foundational",
      "source": "original"
    },
    {
      "id": "pm.capm",
      "name": "Capital Asset Pricing Model (CAPM)",
      "topicId": "pm",
      "conceptIds": [
        "pm.capm-sml",
        "equity.cost-of-equity"
      ],
      "category": "Required Return",
      "equation": {
        "latex": "E(R_i) = R_f + \\beta_i\\,[E(R_m) - R_f]",
        "plain": "E(Ri) = Rf + beta_i * (E(Rm) - Rf)"
      },
      "variables": [
        {
          "symbol": "E(R_i)",
          "name": "Required return on asset i"
        },
        {
          "symbol": "R_f",
          "name": "Risk-free rate"
        },
        {
          "symbol": "β_i",
          "name": "Beta",
          "description": "Sensitivity of asset i to market moves"
        },
        {
          "symbol": "E(R_m)",
          "name": "Expected market return"
        }
      ],
      "purpose": "Estimates the return investors should demand given an asset's systematic risk.",
      "whenToUse": "Finding a cost of equity or a benchmark return for performance judgement.",
      "assumptions": [
        "Only market risk is rewarded",
        "A suitable beta estimate is available"
      ],
      "workedExample": {
        "problem": "Risk-free rate 3%, market return 9%, beta 1.2. Required return?",
        "steps": [
          "Market premium = 9% - 3% = 6%.",
          "1.2 x 6% = 7.2%.",
          "3% + 7.2%."
        ],
        "answer": "10.2%"
      },
      "relatedFormulaIds": [
        "equity.gordon-growth",
        "pm.sharpe-ratio"
      ],
      "commonMistakes": [
        "Multiplying beta by the market return instead of the premium",
        "Mixing nominal and real rates"
      ],
      "tags": [
        "cost-of-equity",
        "beta"
      ],
      "difficulty": "foundational",
      "source": "original"
    },
    {
      "id": "equity.gordon-growth",
      "name": "Gordon growth (constant-growth DDM)",
      "topicId": "equity",
      "conceptIds": [
        "equity.ddm"
      ],
      "category": "Dividend Discount Models",
      "equation": {
        "latex": "V_0 = \\frac{D_1}{r - g}",
        "plain": "V0 = D1 / (r - g)"
      },
      "variables": [
        {
          "symbol": "V_0",
          "name": "Intrinsic value today",
          "unit": "currency"
        },
        {
          "symbol": "D_1",
          "name": "Next year's expected dividend",
          "unit": "currency"
        },
        {
          "symbol": "r",
          "name": "Required return"
        },
        {
          "symbol": "g",
          "name": "Constant dividend growth rate"
        }
      ],
      "purpose": "Values a share whose dividends are expected to grow at a steady rate forever.",
      "whenToUse": "Mature, stable dividend payers where r is clearly greater than g.",
      "assumptions": [
        "g is constant and sustainable",
        "r > g"
      ],
      "workedExample": {
        "problem": "Next dividend 2.00, required return 9%, growth 4%. Value?",
        "steps": [
          "r - g = 0.09 - 0.04 = 0.05.",
          "2.00 / 0.05."
        ],
        "answer": "40.00 per share"
      },
      "relatedFormulaIds": [
        "pm.capm"
      ],
      "commonMistakes": [
        "Using D0 where D1 is required",
        "Applying it when g >= r",
        "Using a growth rate above long-run economic growth"
      ],
      "tags": [
        "valuation",
        "ddm"
      ],
      "difficulty": "intermediate",
      "source": "original"
    },
    {
      "id": "fi.price-change-duration-convexity",
      "name": "Approximate bond price change (duration + convexity)",
      "topicId": "fi",
      "conceptIds": [
        "fi.duration-convexity",
        "fi.price-yield"
      ],
      "category": "Duration & Convexity",
      "equation": {
        "latex": "\\%\\Delta P \\approx -D_{mod}\\,\\Delta y + \\tfrac{1}{2}\\,C\\,(\\Delta y)^{2}",
        "plain": "%dP ≈ -ModDur * dy + 0.5 * Convexity * dy^2"
      },
      "variables": [
        {
          "symbol": "D_mod",
          "name": "Modified duration"
        },
        {
          "symbol": "Δy",
          "name": "Change in yield",
          "description": "As a decimal, e.g. 0.005 for 50 bp"
        },
        {
          "symbol": "C",
          "name": "Convexity"
        }
      ],
      "purpose": "Estimates the percentage move in a bond's price for a given change in its yield.",
      "whenToUse": "Quick interest-rate risk estimates, especially for small to moderate yield changes.",
      "assumptions": [
        "Parallel, small yield shift",
        "No embedded option effects unless effective measures are used"
      ],
      "workedExample": {
        "problem": "Modified duration 7.5, convexity 60, yield rises 0.50%. Estimate the price change.",
        "steps": [
          "Duration term: -7.5 x 0.005 = -3.75%.",
          "Convexity term: 0.5 x 60 x 0.005^2 = +0.075%.",
          "Add them."
        ],
        "answer": "≈ -3.675%"
      },
      "relatedFormulaIds": [],
      "commonMistakes": [
        "Dropping the minus sign",
        "Entering 0.5 instead of 0.005 for a 50 bp change",
        "Using duration alone for large yield moves"
      ],
      "tags": [
        "interest-rate-risk"
      ],
      "difficulty": "intermediate",
      "source": "original"
    },
    {
      "id": "pm.two-asset-variance",
      "name": "Two-asset portfolio variance",
      "topicId": "pm",
      "conceptIds": [
        "pm.portfolio-return-risk",
        "pm.diversification"
      ],
      "category": "Portfolio Risk",
      "equation": {
        "latex": "\\sigma_p^2 = w_1^2\\sigma_1^2 + w_2^2\\sigma_2^2 + 2w_1w_2\\rho_{12}\\sigma_1\\sigma_2",
        "plain": "var_p = w1^2*s1^2 + w2^2*s2^2 + 2*w1*w2*rho12*s1*s2"
      },
      "variables": [